select 1 from (select set_config(name, 'escape', false) as ignore
          from pg_settings where name = 'bytea_output') x
          where x.ignore = 'foo';
 ?column? 
----------
(0 rows)

drop function pgq.insert_event(text, text, text,  text, text, text, text);
create or replace function pgq.insert_event(que text, ev_type text, ev_data text, x1 text, x2 text, x3 text, x4 text)
returns bigint as $$
begin
    raise notice 'insert_event(%, %, %, %)', que, ev_type, ev_data, x1;
    return 1;
end;
$$ language plpgsql;
create table udata (
    id serial primary key,
    txt text,
    bin bytea
);
NOTICE:  CREATE TABLE will create implicit sequence "udata_id_seq" for serial column "udata.id"
NOTICE:  CREATE TABLE / PRIMARY KEY will create implicit index "udata_pkey" for table "udata"
create trigger utest AFTER insert or update or delete ON udata
for each row execute procedure pgq.logutriga('udata_que');
insert into udata (txt) values ('text1');
NOTICE:  insert_event(udata_que, I:id, id=1&txt=text1&bin, public.udata)
CONTEXT:  SQL statement "select pgq.insert_event($1, $2, $3, $4, $5, $6, $7)"
insert into udata (bin) values (E'bi\tn\\000bin');
NOTICE:  insert_event(udata_que, I:id, id=2&txt&bin=bi%5c011n%5c000bin, public.udata)
CONTEXT:  SQL statement "select pgq.insert_event($1, $2, $3, $4, $5, $6, $7)"
-- test ignore
drop trigger utest on udata;
truncate udata;
create trigger utest after insert or update or delete on udata
for each row execute procedure pgq.logutriga('udata_que', 'ignore=bin');
insert into udata values (1, 'txt', 'bin');
NOTICE:  insert_event(udata_que, I:id, id=1&txt=txt, public.udata)
CONTEXT:  SQL statement "select pgq.insert_event($1, $2, $3, $4, $5, $6, $7)"
update udata set txt = 'txt';
NOTICE:  insert_event(udata_que, U:id, id=1&txt=txt, public.udata)
CONTEXT:  SQL statement "select pgq.insert_event($1, $2, $3, $4, $5, $6, $7)"
update udata set txt = 'txt2', bin = 'bin2';
NOTICE:  insert_event(udata_que, U:id, id=1&txt=txt2, public.udata)
CONTEXT:  SQL statement "select pgq.insert_event($1, $2, $3, $4, $5, $6, $7)"
update udata set bin = 'bin3';
delete from udata;
NOTICE:  insert_event(udata_que, D:id, id=1&txt=txt2, public.udata)
CONTEXT:  SQL statement "select pgq.insert_event($1, $2, $3, $4, $5, $6, $7)"
-- test missing pkey
create table nopkey2 (dat text);
create trigger nopkey_triga2 after insert or update or delete on nopkey2
for each row execute procedure pgq.logutriga('que3');
insert into nopkey2 values ('foo');
NOTICE:  insert_event(que3, I:, dat=foo, public.nopkey2)
CONTEXT:  SQL statement "select pgq.insert_event($1, $2, $3, $4, $5, $6, $7)"
update nopkey2 set dat = 'bat';
ERROR:  Update/Delete on table without pkey
delete from nopkey2;
ERROR:  Update/Delete on table without pkey
-- test custom pkey
create table ucustom_pkey (dat1 text not null, dat2 int2 not null, dat3 text);
create trigger ucustom_triga after insert or update or delete on ucustom_pkey
--for each row execute procedure pgq.logutriga('que3', 'pkey=dat1,dat2');
for each row execute procedure pgq.logutriga('que3');
insert into ucustom_pkey values ('foo', '2');
NOTICE:  insert_event(que3, I:, dat1=foo&dat2=2&dat3, public.ucustom_pkey)
CONTEXT:  SQL statement "select pgq.insert_event($1, $2, $3, $4, $5, $6, $7)"
update ucustom_pkey set dat3 = 'bat';
ERROR:  Update/Delete on table without pkey
delete from ucustom_pkey;
ERROR:  Update/Delete on table without pkey
-- test custom fields
create table custom_fields2 (
    dat1 text not null primary key,
    dat2 int2 not null,
    dat3 text,
    _pgq_ev_type text default 'my_type',
    _pgq_ev_extra1 text default 'e1',
    _pgq_ev_extra2 text default 'e2',
    _pgq_ev_extra3 text default 'e3',
    _pgq_ev_extra4 text default 'e4'
);
NOTICE:  CREATE TABLE / PRIMARY KEY will create implicit index "custom_fields2_pkey" for table "custom_fields2"
create trigger customf2_triga after insert or update or delete on custom_fields2
for each row execute procedure pgq.logutriga('que3');
insert into custom_fields2 values ('foo', '2');
NOTICE:  insert_event(que3, my_type, dat1=foo&dat2=2&dat3, e1)
CONTEXT:  SQL statement "select pgq.insert_event($1, $2, $3, $4, $5, $6, $7)"
update custom_fields2 set dat3 = 'bat';
NOTICE:  insert_event(que3, my_type, dat1=foo&dat2=2&dat3=bat, e1)
CONTEXT:  SQL statement "select pgq.insert_event($1, $2, $3, $4, $5, $6, $7)"
delete from custom_fields2;
NOTICE:  insert_event(que3, my_type, dat1=foo&dat2=2&dat3=bat, e1)
CONTEXT:  SQL statement "select pgq.insert_event($1, $2, $3, $4, $5, $6, $7)"
-- test custom expression
create table custom_expr2 (
    dat1 text not null primary key,
    dat2 int2 not null,
    dat3 text
);
NOTICE:  CREATE TABLE / PRIMARY KEY will create implicit index "custom_expr2_pkey" for table "custom_expr2"
create trigger customex2_triga after insert or update or delete on custom_expr2
for each row execute procedure pgq.logutriga('que3', 'ev_extra1=''test='' || dat1', 'ev_type=dat3');
insert into custom_expr2 values ('foo', '2');
NOTICE:  insert_event(que3, <NULL>, dat1=foo&dat2=2&dat3, test=foo)
CONTEXT:  SQL statement "select pgq.insert_event($1, $2, $3, $4, $5, $6, $7)"
update custom_expr2 set dat3 = 'bat';
NOTICE:  insert_event(que3, bat, dat1=foo&dat2=2&dat3=bat, test=foo)
CONTEXT:  SQL statement "select pgq.insert_event($1, $2, $3, $4, $5, $6, $7)"
delete from custom_expr2;
NOTICE:  insert_event(que3, bat, dat1=foo&dat2=2&dat3=bat, test=foo)
CONTEXT:  SQL statement "select pgq.insert_event($1, $2, $3, $4, $5, $6, $7)"
-- test when=
create table when_test (
    dat1 text not null primary key,
    dat2 int2 not null,
    dat3 text
);
NOTICE:  CREATE TABLE / PRIMARY KEY will create implicit index "when_test_pkey" for table "when_test"
create trigger when_triga after insert or update or delete on when_test
for each row execute procedure pgq.logutriga('que3', 'when=dat1=''foo''');
insert into when_test values ('foo', '2');
NOTICE:  insert_event(que3, I:dat1, dat1=foo&dat2=2&dat3, public.when_test)
CONTEXT:  SQL statement "select pgq.insert_event($1, $2, $3, $4, $5, $6, $7)"
insert into when_test values ('bar', '2');
select * from when_test;
 dat1 | dat2 | dat3 
------+------+------
 foo  |    2 | 
 bar  |    2 | 
(2 rows)

update when_test set dat3 = 'bat';
NOTICE:  insert_event(que3, U:dat1, dat1=foo&dat2=2&dat3=bat, public.when_test)
CONTEXT:  SQL statement "select pgq.insert_event($1, $2, $3, $4, $5, $6, $7)"
delete from when_test;
NOTICE:  insert_event(que3, D:dat1, dat1=foo&dat2=2&dat3=bat, public.when_test)
CONTEXT:  SQL statement "select pgq.insert_event($1, $2, $3, $4, $5, $6, $7)"
drop trigger when_triga on when_test;
create trigger when_triga after insert or update or delete on when_test
for each row execute procedure pgq.logutriga('que3', 'when=current_user=''random''');
insert into when_test values ('foo', '2');
select * from when_test;
 dat1 | dat2 | dat3 
------+------+------
 foo  |    2 | 
(1 row)

-- test truncate
create trigger trunc_triga after truncate on when_test
for each statement execute procedure pgq.logutriga('que3');
truncate when_test;
NOTICE:  insert_event(que3, R, , public.when_test)
CONTEXT:  SQL statement "select pgq.insert_event($1, $2, $3, $4, $5, $6, $7)"
